{
  "$schema": "../schemas/ai-capabilities.schema.json",
  "pack": {
    "id": "pack.ai-capabilities.phase1",
    "version": "0.1.0-draft",
    "label": "Phase 1 AI capability registry seed",
    "description": "Provider-neutral capability, output-contract, and tool-class identifiers; every route is disabled, review-only, non-clinical, and proposal-only.",
    "meta_ref": "meta.ai-draft",
    "retirement": {"state": "ACTIVE_DRAFT", "supersedes_ref": null, "replacement_ref": null, "retired_at": null},
    "decision_refs": ["DEC-034", "DEC-035", "DEC-036"],
    "contract_refs": ["AI-CAP-001", "AI-OUT-001", "AI-TOOL-001", "AI-GRD-001", "AI-EVAL-001"],
    "attributes": {"runtime_enabled": false, "provider_selected": false, "production_slices_selected": false, "clinical_allowed": false, "aggregate_score_enabled": false}
  },
  "tool_classes": [
    {"id": "tool-class.READ_EVIDENCE", "version": "0.1.0-draft", "label": "Read evidence", "description": "Read current authorized minimum evidence with exact lineage.", "meta_ref": "meta.ai-draft", "retirement": {"state": "ACTIVE_DRAFT", "supersedes_ref": null, "replacement_ref": null, "retired_at": null}, "decision_refs": ["DEC-035", "DEC-036"], "contract_refs": ["AI-TOOL-P1-012", "AI-TOOL-P1-019"], "attributes": {"code": "READ_EVIDENCE", "effect_class": "READ_ONLY", "model_direct_effect_authority": false, "runtime_enabled": false}},
    {"id": "tool-class.READ_DERIVED", "version": "0.1.0-draft", "label": "Read derived", "description": "Read bounded permission-trimmed derived views with coverage and watermarks.", "meta_ref": "meta.ai-draft", "retirement": {"state": "ACTIVE_DRAFT", "supersedes_ref": null, "replacement_ref": null, "retired_at": null}, "decision_refs": ["DEC-035", "DEC-036"], "contract_refs": ["AI-TOOL-P1-012", "AI-TOOL-P1-014"], "attributes": {"code": "READ_DERIVED", "effect_class": "READ_ONLY", "model_direct_effect_authority": false, "runtime_enabled": false}},
    {"id": "tool-class.EVALUATE_DETERMINISTIC", "version": "0.1.0-draft", "label": "Evaluate deterministic rule", "description": "Evaluate closed schemas, rules, dates, policies, digests, or graph constraints without model authority.", "meta_ref": "meta.ai-draft", "retirement": {"state": "ACTIVE_DRAFT", "supersedes_ref": null, "replacement_ref": null, "retired_at": null}, "decision_refs": ["DEC-035"], "contract_refs": ["AI-TOOL-P1-010"], "attributes": {"code": "EVALUATE_DETERMINISTIC", "effect_class": "DETERMINISTIC_EVALUATION", "model_direct_effect_authority": false, "runtime_enabled": false}},
    {"id": "tool-class.CREATE_PROPOSAL", "version": "0.1.0-draft", "label": "Create inert proposal", "description": "Append a validated immutable proposal only; no domain truth or effect is set.", "meta_ref": "meta.ai-draft", "retirement": {"state": "ACTIVE_DRAFT", "supersedes_ref": null, "replacement_ref": null, "retired_at": null}, "decision_refs": ["DEC-035"], "contract_refs": ["AI-TOOL-P1-020", "AI-OUT-P1-019"], "attributes": {"code": "CREATE_PROPOSAL", "effect_class": "INERT_PROPOSAL", "model_direct_effect_authority": false, "runtime_enabled": false}},
    {"id": "tool-class.PREVIEW_EFFECT", "version": "0.1.0-draft", "label": "Preview effect", "description": "Create an authorized preview and effect digest without submission or mutation.", "meta_ref": "meta.ai-draft", "retirement": {"state": "ACTIVE_DRAFT", "supersedes_ref": null, "replacement_ref": null, "retired_at": null}, "decision_refs": ["DEC-035", "DEC-037"], "contract_refs": ["AI-TOOL-P1-021"], "attributes": {"code": "PREVIEW_EFFECT", "effect_class": "PREVIEW_ONLY", "model_direct_effect_authority": false, "runtime_enabled": false}},
    {"id": "tool-class.CONSEQUENTIAL_EFFECT", "version": "0.1.0-draft", "label": "Consequential effect", "description": "Representable owning-workflow effect class; it is never directly callable by a model in Phase 1.", "meta_ref": "meta.security-draft", "retirement": {"state": "ACTIVE_DRAFT", "supersedes_ref": null, "replacement_ref": null, "retired_at": null}, "decision_refs": ["DEC-035", "DEC-037"], "contract_refs": ["AI-TOOL-P1-021", "AUTH-P1-014"], "attributes": {"code": "CONSEQUENTIAL_EFFECT", "effect_class": "CONSEQUENTIAL", "model_direct_effect_authority": false, "runtime_enabled": false}},
    {"id": "tool-class.EXTERNAL_RETRIEVAL", "version": "0.1.0-draft", "label": "Governed external retrieval", "description": "Pre-approved source or connector route only; arbitrary content-derived URLs are forbidden.", "meta_ref": "meta.source-draft", "retirement": {"state": "ACTIVE_DRAFT", "supersedes_ref": null, "replacement_ref": null, "retired_at": null}, "decision_refs": ["DEC-031", "DEC-035"], "contract_refs": ["AI-TOOL-P1-016", "AI-GRD-P1-021"], "attributes": {"code": "EXTERNAL_RETRIEVAL", "effect_class": "GOVERNED_RETRIEVAL", "model_direct_effect_authority": false, "runtime_enabled": false}}
  ],
  "output_contracts": [
    {"id": "ai.ingestion_plan", "version": "0.1.0-draft", "label": "Ingestion plan output", "description": "Typed stage/checkpoint eligibility and degradation proposal.", "meta_ref": "meta.ai-draft", "retirement": {"state": "ACTIVE_DRAFT", "supersedes_ref": null, "replacement_ref": null, "retired_at": null}, "decision_refs": ["DEC-035", "DEC-036"], "contract_refs": ["AI-OUT-P1-001", "DIT-ING-001"], "attributes": {"payload_id": "ai.ingestion_plan", "capability_ref": "AI-CAP-P1-001", "output_status_machine_ref": "machine.ai-output-status", "execution_authority": "NONE", "additional_properties_allowed": false, "runtime_enabled": false}},
    {"id": "ai.classification_proposal", "version": "0.1.0-draft", "label": "Classification proposal output", "description": "Typed document-profile classification proposal with evidence and review reasons.", "meta_ref": "meta.ai-draft", "retirement": {"state": "ACTIVE_DRAFT", "supersedes_ref": null, "replacement_ref": null, "retired_at": null}, "decision_refs": ["DEC-035", "DEC-036"], "contract_refs": ["AI-OUT-P1-001", "DIT-TAX-001"], "attributes": {"payload_id": "ai.classification_proposal", "capability_ref": "AI-CAP-P1-002", "output_status_machine_ref": "machine.ai-output-status", "execution_authority": "NONE", "additional_properties_allowed": false, "runtime_enabled": false}},
    {"id": "ai.extraction_result_set", "version": "0.1.0-draft", "label": "Extraction result output", "description": "Typed evidence-bearing extraction result set proposal.", "meta_ref": "meta.ai-draft", "retirement": {"state": "ACTIVE_DRAFT", "supersedes_ref": null, "replacement_ref": null, "retired_at": null}, "decision_refs": ["DEC-035", "DEC-036"], "contract_refs": ["AI-OUT-P1-001", "DIT-EXT-001"], "attributes": {"payload_id": "ai.extraction_result_set", "capability_ref": "AI-CAP-P1-003", "output_status_machine_ref": "machine.ai-output-status", "execution_authority": "NONE", "additional_properties_allowed": false, "runtime_enabled": false}},
    {"id": "ai.subject_resolution_proposal", "version": "0.1.0-draft", "label": "Subject resolution proposal output", "description": "Typed entity/subject candidate proposal without merge or canonical authority.", "meta_ref": "meta.ai-draft", "retirement": {"state": "ACTIVE_DRAFT", "supersedes_ref": null, "replacement_ref": null, "retired_at": null}, "decision_refs": ["DEC-035", "DEC-036"], "contract_refs": ["AI-OUT-P1-001", "DIT-FCT-001"], "attributes": {"payload_id": "ai.subject_resolution_proposal", "capability_ref": "AI-CAP-P1-004", "output_status_machine_ref": "machine.ai-output-status", "execution_authority": "NONE", "additional_properties_allowed": false, "runtime_enabled": false}},
    {"id": "ai.document_analysis", "version": "0.1.0-draft", "label": "Document analysis output", "description": "Typed claims, dates, clauses, obligations, and relationships as evidence-bound proposals.", "meta_ref": "meta.ai-draft", "retirement": {"state": "ACTIVE_DRAFT", "supersedes_ref": null, "replacement_ref": null, "retired_at": null}, "decision_refs": ["DEC-035", "DEC-036"], "contract_refs": ["AI-OUT-P1-001", "DIT-VER-001"], "attributes": {"payload_id": "ai.document_analysis", "capability_ref": "AI-CAP-P1-005", "output_status_machine_ref": "machine.ai-output-status", "execution_authority": "NONE", "additional_properties_allowed": false, "runtime_enabled": false}},
    {"id": "ai.dependency_edge_proposals", "version": "0.1.0-draft", "label": "Dependency edge proposal output", "description": "Typed directed dependency proposals with endpoint revisions and provenance.", "meta_ref": "meta.ai-draft", "retirement": {"state": "ACTIVE_DRAFT", "supersedes_ref": null, "replacement_ref": null, "retired_at": null}, "decision_refs": ["DEC-035", "DEC-036"], "contract_refs": ["AI-OUT-P1-001", "DIT-GPH-001"], "attributes": {"payload_id": "ai.dependency_edge_proposals", "capability_ref": "AI-CAP-P1-006", "output_status_machine_ref": "machine.ai-output-status", "execution_authority": "NONE", "additional_properties_allowed": false, "runtime_enabled": false}},
    {"id": "ai.change_analysis", "version": "0.1.0-draft", "label": "Change analysis output", "description": "Ordered exact-version comparison proposal with coverage and two-sided anchors.", "meta_ref": "meta.ai-draft", "retirement": {"state": "ACTIVE_DRAFT", "supersedes_ref": null, "replacement_ref": null, "retired_at": null}, "decision_refs": ["DEC-035", "DEC-036"], "contract_refs": ["AI-OUT-P1-001", "DIT-VER-001"], "attributes": {"payload_id": "ai.change_analysis", "capability_ref": "AI-CAP-P1-007", "output_status_machine_ref": "machine.ai-output-status", "execution_authority": "NONE", "additional_properties_allowed": false, "runtime_enabled": false}},